"_SYSTEM_ID","Question External Id","Question Name"
"6512a201d5801179962eba7a","SUR_TEST_001_1695719929184","Enter your First question"
"6512a202d5801179962eba80","SUR_TEST_002_1695719929184","Enter your Second question"
"6512a202d5801179962eba86","SUR_TEST_003_1695719929184","Are you planning to come back?"
"6512a202d5801179962eba8d","SUR_TEST_004_1695719929184","What type of device is available at home?"
"6512a202d5801179962eba93","SUR_TEST_005_1695719929184","Does the child have a quiet place to study?"
"6512a202d5801179962eba99","SUR_TEST_006_1695719929184","Were you able to enroll your child in courses on Diksha?"
"6512a202d5801179962ebaa0","SUR_TEST_007_1695719929184","What are the challenges that you are facing in enrolment?"